{"schema_version":1,"program_id":"production-runtime","mission_id":"M1","run_id":"run-fixture-pass","source_commit":"1111111111111111111111111111111111111111","source_tree":"2222222222222222222222222222222222222222","admitted_tuple_sha256":"4ddf904a48c83fe343ea9589bdf6ef7108af71b4b8140d76da68abdaf9d5824d","sidecar_provenance_sha256":"a9d5f6d002d956b8af5787a05e0ca000d45c03977ffa54ee8fbed719fed5fd23","scenario_results":[{"scenario_id":"data/get-put","run_id":"run-fixture-pass","seed":1,"started":true,"terminal":true,"outcome":"pass","artifact_sha256":"916c87f91d878d431a67d247acf6c772ca0856538720b34cd9224206ee2ec11a"},{"scenario_id":"conditional/cas-delete","run_id":"run-fixture-pass","seed":2,"started":true,"terminal":true,"outcome":"pass","artifact_sha256":"b19d786445d5d7b22bedc41c476a2d66268dbd1aef8c6ef016c5dfd8e2c8e7cd"},{"scenario_id":"batch/atomic","run_id":"run-fixture-pass","seed":3,"started":true,"terminal":true,"outcome":"pass","artifact_sha256":"eed8701bd5471e147e1bb79a4c371cef85c674082573eac238ced6dc53cd7d0b"},{"scenario_id":"scan/sorted-prefix","run_id":"run-fixture-pass","seed":4,"started":true,"terminal":true,"outcome":"pass","artifact_sha256":"f8d27e679c77733b4d322c52679f633ede1975774bc8b0fbc30d2c81c227cd8b"},{"scenario_id":"watch/registered-order","run_id":"run-fixture-pass","seed":5,"started":true,"terminal":true,"outcome":"pass","artifact_sha256":"049da6a6ba75660fce4c58c269b65a1c5dff7fa9f3e15fea7c6eccba3bdd14eb"},{"scenario_id":"expiry/release-authority","run_id":"run-fixture-pass","seed":6,"started":true,"terminal":true,"outcome":"pass","artifact_sha256":"815a1a547832a7324f1777e25f92d061ba2ea59e7e1263253e4b2a98540d3464"},{"scenario_id":"ack/memory-visible","run_id":"run-fixture-pass","seed":7,"started":true,"terminal":true,"outcome":"pass","artifact_sha256":"e2bdce04f117485c62e7246f14b858ebfd39b68da0c19e58a581ba3486d1c719"},{"scenario_id":"ack/durable-restart","run_id":"run-fixture-pass","seed":8,"started":true,"terminal":true,"outcome":"pass","artifact_sha256":"7282b030122351074aea1ce43330880d612c1e3cee78ec7d4f55b70f2f33ddce"},{"scenario_id":"inspect/authority","run_id":"run-fixture-pass","seed":9,"started":true,"terminal":true,"outcome":"pass","artifact_sha256":"3e284982c0662f0f9c006cad4b94db3b5de22befdb89bf2ef8116c1d5479bc9e"},{"scenario_id":"authority/lease","run_id":"run-fixture-pass","seed":10,"started":true,"terminal":true,"outcome":"pass","artifact_sha256":"37f059158c33dcf35259dbcc7bc5e42422e75d7bd89d3208a592e76d100f161e"},{"scenario_id":"authority/review","run_id":"run-fixture-pass","seed":11,"started":true,"terminal":true,"outcome":"pass","artifact_sha256":"3d0054ceb77f1dcd5ce1229139c3978faf9cf900da942801d855ada2148ffc8d"},{"scenario_id":"authority/workflow","run_id":"run-fixture-pass","seed":12,"started":true,"terminal":true,"outcome":"pass","artifact_sha256":"a9159eec88ee8929305782421615ad19a768b9dcd80e2763d7ac5b8d9a4cdc55"},{"scenario_id":"authority/integration","run_id":"run-fixture-pass","seed":13,"started":true,"terminal":true,"outcome":"pass","artifact_sha256":"b8c09e0722203d0a489f2c9cb1b2e89e1211083325328fb659fa9bce6fc7e791"},{"scenario_id":"response-loss/reconcile","run_id":"run-fixture-pass","seed":14,"started":true,"terminal":true,"outcome":"pass","artifact_sha256":"3ffb85f8fb8eb35b8103df1f47ee09aa298e7142557c2abc0cebf10e247dd60c"}],"fault_results":[{"fault_id":"GJ-01","run_id":"run-fixture-pass","seed":100,"cut":"before_request_publication","started":true,"terminal":true,"outcome":"pass","artifact_sha256":"c09ac7f52ddb79cf678e565eb29e498008662e795c5d57be6de7c5fcdb19f869"},{"fault_id":"GJ-02","run_id":"run-fixture-pass","seed":101,"cut":"after_durable_acceptance_before_client_response","started":true,"terminal":true,"outcome":"pass","artifact_sha256":"3ac425627a1700b59a8f032aa91cd8ee3d352393ce5635421bb3480ee812ce75"},{"fault_id":"GJ-03","run_id":"run-fixture-pass","seed":102,"cut":"after_workspace_creation_before_durable_binding","started":true,"terminal":true,"outcome":"pass","artifact_sha256":"ad98e3c85cd6336271a5d80078dbaa9a699bcdc26b8ee7f3600e05669c60244a"},{"fault_id":"GJ-04","run_id":"run-fixture-pass","seed":103,"cut":"after_durable_binding_before_run_capsule_response","started":true,"terminal":true,"outcome":"pass","artifact_sha256":"5d7524db29b58bebcbc745409fe326d51a40d207b51beaf7ff3708fba6bcd815"},{"fault_id":"GJ-05","run_id":"run-fixture-pass","seed":104,"cut":"after_effect_intent_before_observation","started":true,"terminal":true,"outcome":"pass","artifact_sha256":"09aaea6aa2fb76db88728dd66aed1bbcd71a1d2fb0732dda75ce95ed22cd489a"}],"ordered_trial":{"schema_version":1,"run_id":"run-fixture-pass","trial_id":"m1-ordered-torture-trial","started":true,"terminal":true,"outcome":"pass","fr_044_satisfied":true,"sc_013_satisfied":true,"identities":{"implementation_a":{"actor_id":"actor-a","process_id":"process-a","workspace_id":"workspace-crown-w1"},"implementation_b":{"actor_id":"actor-b","process_id":"process-b","workspace_id":"workspace-crown-w2"},"replacement_c":{"actor_id":"actor-a","process_id":"process-c","workspace_id":"workspace-crown-w3"}},"workspace_isolation":{"w1_quarantined":true,"w2_preserved":true,"w3_fresh":true,"zombie_authority_successes":0},"owner_restart":{"same_umbrella_run":true,"before_runtime_epoch_id":"epoch-before","after_runtime_epoch_id":"epoch-after","new_epoch_admitted":true},"old_capsule":{"predecessor_runtime_epoch_id":"epoch-before","refused":true,"reason_kind":"runtime_epoch_conflict"},"restore_playback":{"restore_digest":"aaaaaaaaaaaaaaaaaaaaaaaaaaaaaaaaaaaaaaaaaaaaaaaaaaaaaaaaaaaaaaaa","playback_digest":"aaaaaaaaaaaaaaaaaaaaaaaaaaaaaaaaaaaaaaaaaaaaaaaaaaaaaaaaaaaaaaaa","digests_equal":true,"playback_adapter_calls":0,"playback_durable_writes":0},"reviews":[{"candidate_id":"candidate-w2","contributor_actor_ids":["B"],"reviewer_actor_id":"reviewer-one","actor_independent":true,"verdict":"approved"},{"candidate_id":"candidate-w3","contributor_actor_ids":["A"],"reviewer_actor_id":"reviewer-two","actor_independent":true,"verdict":"approved"}],"integration":{"target_ref":"refs/heads/main","candidate_ids":["candidate-w2","candidate-w3"],"publication_order":["candidate-w2","candidate-w3"],"competing_attempts":2,"serialized":true,"successful_publications":2,"false_completions":0},"artifact_sha256":"36468a69dab64881330761f3423d57ceb7d404ef9e51ceb1cefe6512d72a24ad"},"focused_subtrial_summaries":[{"id":"atomic-publication-nfr001","run_id":"run-fixture-pass","repetitions_started":100,"repetitions_terminal":100,"repetitions_passed":100,"artifact_sha256":"7a50670880b48b1443da21d9f1222b103bfc87baaea948bfd7308c01c1e8d986"},{"id":"lost-response-idempotency-nfr002","run_id":"run-fixture-pass","repetitions_started":100,"repetitions_terminal":100,"repetitions_passed":100,"artifact_sha256":"73c627048480e26fae954e0057d99352a8b18e760d1d6ba58ef1bb5bc9526173"},{"id":"concurrent-claims-nfr003","run_id":"run-fixture-pass","repetitions_started":100,"repetitions_terminal":100,"repetitions_passed":100,"artifact_sha256":"7b5f8fe8cbd46b24f58808061d80d208b5adcc7a86b827fb6ef92d0d2514fb15"},{"id":"competing-integrations-nfr004","run_id":"run-fixture-pass","repetitions_started":100,"repetitions_terminal":100,"repetitions_passed":100,"artifact_sha256":"60fc75a50aa797400ed11e5455768b60b3e9835728b3b4824ddaf013623cb7d4"},{"id":"restore-playback-nfr005","run_id":"run-fixture-pass","repetitions_started":100,"repetitions_terminal":100,"repetitions_passed":100,"artifact_sha256":"2447189addf84ca33744139d086c5cc0fd65f366e68115b6bc4e102f763d43aa"},{"id":"restart-epoch-nfr007","run_id":"run-fixture-pass","repetitions_started":100,"repetitions_terminal":100,"repetitions_passed":100,"artifact_sha256":"7c88b66841024c6c3c3faf341773d74e91391bfeb7088da1392c2cb594c7072d"},{"id":"zombie-isolation-nfr008","run_id":"run-fixture-pass","repetitions_started":100,"repetitions_terminal":100,"repetitions_passed":100,"artifact_sha256":"c020200c58b2096fa5a4abcac093dca9c4780c4f225e698e8212063fcb777600"},{"id":"attribution-reassignment-nfr015","run_id":"run-fixture-pass","repetitions_started":100,"repetitions_terminal":100,"repetitions_passed":100,"artifact_sha256":"e83dd943b28011cfaae7855c630c3360ec7a8cc8cab6fe30482ff3da68d5ac9c"}],"mutant_results":[{"id":"split-batch","run_id":"run-fixture-pass","outcome":"killed","artifact_sha256":"b330ea916929419d8343bb1d713e0749339ce85406d513e375c9e140dedf8bee"},{"id":"pre-ack-publish","run_id":"run-fixture-pass","outcome":"killed","artifact_sha256":"7dc106d65214376cc1d115a382f8d28ec2818ae64e79a93cbb4e78041e83fe8e"},{"id":"retry-new-operation-id","run_id":"run-fixture-pass","outcome":"killed","artifact_sha256":"f662a8c50fc6e72f245e6c79f01cf25ccfd3fb2b0af17c8e1ccda3c71c396303"},{"id":"revision-fill-in","run_id":"run-fixture-pass","outcome":"killed","artifact_sha256":"0caaf34d1511fe425a1e3fce61f26cb3c7f0c8d9b452ef425cfd0c3d0dd6aa99"},{"id":"server-revision-in-value-or-key","run_id":"run-fixture-pass","outcome":"killed","artifact_sha256":"0faab1cab74f82d0da6df8cebfa93d1d26858b8d929b9ba465ad959be8ed1b91"},{"id":"invalid-event-order","run_id":"run-fixture-pass","outcome":"killed","artifact_sha256":"87c9c5c800d1e7130a9a80dbe2c509404026d20ac136b7237075c06ae386872b"},{"id":"current-batch-checkpoint","run_id":"run-fixture-pass","outcome":"killed","artifact_sha256":"cb1c4ae81845ccb58272a4d1a3bb9f0c39d0f4d7afc78cb026f8db8483c3bba8"},{"id":"global-authority-cas","run_id":"run-fixture-pass","outcome":"killed","artifact_sha256":"4ee9b70b31c64434a589c1c44461e15eddfa013322ac9cc7f38b7f029419000f"},{"id":"shared-projection-head","run_id":"run-fixture-pass","outcome":"killed","artifact_sha256":"298eaa88a9285fe679febda9e03c3688c4617079a6fcc4f52f4de6ca68a456e2"},{"id":"runtime-coordinate-conflation","run_id":"run-fixture-pass","outcome":"killed","artifact_sha256":"b594912d0c60da67b9e1af475629953656dee839eaa45ec35d1e285e8fadb1fa"},{"id":"workspace-reuse","run_id":"run-fixture-pass","outcome":"killed","artifact_sha256":"2f8593ef3350f6ebcee4cd4335f9c18f0c6997eebba57ff625116649b6229d3e"}